Index,Grant Code,TITLE,PI's Name,PI's ID,Sponsor,PI's Home Dept,College,Total Expenditure,Overhead,Tuition/Fees
1,AN2573,DHHS NIH Malaria & Allergic Inflam.,Shirley Luckhart,V00557173, Dept. Health and Human Services,"CALS Entomology,Plt Pathology,Nemat",CALS Col of Agri & Life Sciences,331082.16,104722.36,5891.5
2,AN1861,*I* DHHS NIH Anopheline Mosquitoes,Shirley Luckhart,V00557173, Dept. Health and Human Services,"CALS Entomology,Plt Pathology,Nemat",CALS Col of Agri & Life Sciences,97672.95,2372.58,0
3,AN3260,*I* Univ Ariz Mitochondrial Activit,Shirley Luckhart,V00557173, University of Arizona,"CALS Entomology,Plt Pathology,Nemat",CALS Col of Agri & Life Sciences,51711,16652.76,0
4,AN1956,*I* HENMJA Malaria Transmission,Shirley Luckhart,V00557173, Henry M. Jackson Foundation,"CALS Entomology,Plt Pathology,Nemat",CALS Col of Agri & Life Sciences,25434.92,8190.88,0
5,AN1932,*I*UA AnophelineFitness&Resistance,Shirley Luckhart,V00557173, University of Arizona,"CALS Entomology,Plt Pathology,Nemat",CALS Col of Agri & Life Sciences,-0.6,-0.6,0
